  {                                                                                                                                                                                                            
    "@context": [                                                                                                                                                                                              
      "https://www.w3.org/2018/credentials/v1",                                                                                                                                                                
      "https://schema.org/",                                                                                                                                                                                   
      "https://nfh-trust-labs.github.io/vc-schemas/energy-credentials/program-enrollment-vc/context.jsonld"                                                                                                    
    ],                                                                                                                                                                                                         
    "id": "urn:uuid:7f8e9d0c-5678-1234-abcd-123456789abc",                                                                                                                                                     
    "type": ["VerifiableCredential", "UtilityProgramEnrollmentCredential"],                                                                                                                                    
    "issuer": {                                                                                                                                                                                                
      "id": "did:web:bescom.karnataka.gov.in",                                                                                                                                                                 
      "name": "BESCOM - Bangalore Electricity Supply Company",                                                                                                                                                 
      "licenseNumber": "KERC/DL/BESCOM/2024"                                                                                                                                                                   
    },                                                                                                                                                                                                         
    "issuanceDate": "2025-01-15T11:00:00Z",                                                                                                                                                                    
    "credentialSubject": {                                                                                                                                                                                     
      "id": "did:example:consumer:priya123",                                                                                                                                                                   
      "consumerNumber": "BESCOM-2025-MR4-567890",                                                                                                                                                              
      "fullName": "Priya Sharma",                                                                                                                                                                              
      "programName": "BESCOM Surya Raitha - Rooftop Solar Net Metering",                                                                                                                                       
      "programCode": "SRTPV-NM-2025",                                                                                                                                                                          
      "enrollmentDate": "2025-01-15"                                                                                                                                                                           
    }                                                                                                                                                                                                          
  }                                                                                                                                                                                                            
